### ISSUE TITLE
局域网主机docker  FCC 收不到udp 大包

### ISSUE THREAD

**Issue by bsdcpp** [stackia/rtp2httpd#403]
openwrt路由器配置：iptv (br-vlan85）配置了默认路由
```bash
root@OpenWrt:/etc/config# ip ru
0:	from all lookup local
1:	from all lookup main suppress_prefixlength 0
2:	from all to 124.75.0.0/16 lookup iptv
```
```bash
root@OpenWrt:/etc/config# ip r s t iptv
default via 30.180.0.1 dev br-vlan85 proto static src 30.180.227.167 metric 5
30.180.0.0/16 dev br-vlan85 proto static scope link metric 5
```

```bash
config forwarding
	option src 'lan'
	option dest 'iptv'

config forwarding
	option src 'iptv'
	option dest 'lan'

config rule
	option name 'FCC-UDP-Forward-Large'
	option family 'ipv4'
	option src 'iptv'
	option dest 'lan'
	option proto 'udp'
	option target 'ACCEPT'
```

局域网主机192.168.2.248，配置如下
docker-compose.yaml
```yaml
services:
  rtp2httpd:
    image: ghcr.io/stackia/rtp2httpd:latest
    network_mode: host
    restart: unless-stopped
    cap_add:
      - NET_ADMIN
    ulimits:
      memlock:
        soft: -1
        hard: -1
    volumes:
      - ./rtp2httpd.conf:/etc/rtp2httpd.conf:ro
    command: -c /etc/rtp2httpd.conf
```
现在播放：```http://192.168.2.248:5140/rtp/233.18.204.81:5140?fcc=124.75.25.215:7777```

debug日志
```bash
16:08:21 INFO [Worker 0] New client 192.168.2.4:63862 requested URL: /assets/icon.png (method: GET)
16:08:21 INFO [Worker 0] New client 192.168.2.4:63863 requested URL: /%E5%A4%AE%E8%A7%86/CCTV-15HD?r2h-token=03515035a69a69de315416eeb5fdb4d6 (method: GET)
16:08:21 DEBUG [Worker 0] r2h-token validated (source: query)
16:08:21 INFO [Worker 0] Service matched: 央视/CCTV-15HD
16:08:21 DEBUG [Worker 0] Creating RTP service with merged URL: rtp://233.18.204.81:5140?fcc=124.75.25.215:7777&r2h-token=03515035a69a69de315416eeb5fdb4d6
16:08:21 DEBUG [Worker 0] Parsed RTP URL: mcast=233.18.204.81:5140
16:08:21 DEBUG [Worker 0]  fcc=124.75.25.215:7777
16:08:21 DEBUG [Worker 0] Created RTP service from URL: rtp://233.18.204.81:5140?fcc=124.75.25.215:7777&r2h-token=03515035a69a69de315416eeb5fdb4d6
16:08:21 INFO [Worker 0] FCC: Using Telecom/ZTE/Fiberhome FCC protocol
16:08:21 DEBUG [Worker 0] FCC: Initializing FCC session and sending request
16:08:21 DEBUG [Worker 0] FCC: Socket registered with poller
16:08:21 DEBUG [Worker 0] FCC (Telecom): Request (FMT 2) sent to server 124.75.25.215:7777
16:08:21 DEBUG [Worker 0] FCC State: INIT -> REQUESTED (Request sent)
16:08:21 DEBUG [Worker 0] FCC Response: FMT=3, result=0, signal_port=0, media_port=42390, valid_time=0, speed=0 bps, speed_after_sync=0 bps
16:08:21 DEBUG [Worker 0] FCC (Telecom): Server provided new media port: 42390
16:08:21 DEBUG [Worker 0] FCC State: REQUESTED -> UNICAST_PENDING (Server accepted request)
16:08:21 DEBUG [Worker 0] FCC (Telecom): Server accepted request, waiting for unicast stream
16:08:22 DEBUG [Worker 0] Client disconnected
16:08:22 DEBUG [Worker 0] FCC: Sending termination packet (cleanup)
16:08:22 DEBUG [Worker 0] FCC (Telecom): Termination packet (FMT 5) sent (cleanup), seqn=0
16:08:22 DEBUG [Worker 0] FCC: Socket closed
16:08:22 DEBUG [Worker 0] Multicast: Socket closed
16:08:22 WARN [Worker 0] FCC: Server response timeout (80 ms), falling back to multicast
16:08:22 DEBUG [Worker 0] FCC State: UNICAST_PENDING -> MCAST_ACTIVE (First unicast packet timeout)
16:08:22 INFO [Worker 0] Multicast: Successfully joined group
16:08:22 DEBUG [Worker 0] Multicast: Socket registered with poller
16:08:22 DEBUG [Worker 0] RTP reorder: Init complete, base_seq=48988 (8 packets collected)
```

路由器抓包记录:
```bash
listening on any, link-type LINUX_SLL2 (Linux cooked v2), snapshot length 262144 bytes
16:01:13.502411 eth3  P   IP 192.168.2.248.40002 > 124.75.25.215.7777: UDP, length 16
16:01:13.502411 br-lan In  IP 192.168.2.248.40002 > 124.75.25.215.7777: UDP, length 16
16:01:13.502470 br-vlan85 Out IP 30.180.227.167.40002 > 124.75.25.215.7777: UDP, length 16
16:01:13.502475 eth0.85 Out IP 30.180.227.167.40002 > 124.75.25.215.7777: UDP, length 16
16:01:13.502478 eth0  Out IP 30.180.227.167.40002 > 124.75.25.215.7777: UDP, length 16
16:01:13.502411 eth3  P   IP 192.168.2.248.40002 > 124.75.25.215.7777: UDP, length 16
16:01:13.502411 br-lan In  IP 192.168.2.248.40002 > 124.75.25.215.7777: UDP, length 16
16:01:13.502507 br-vlan85 Out IP 30.180.227.167.40002 > 124.75.25.215.7777: UDP, length 16
16:01:13.502510 eth0.85 Out IP 30.180.227.167.40002 > 124.75.25.215.7777: UDP, length 16
16:01:13.502513 eth0  Out IP 30.180.227.167.40002 > 124.75.25.215.7777: UDP, length 16
16:01:13.502411 eth3  P   IP 192.168.2.248.40002 > 124.75.25.215.7777: UDP, length 16
16:01:13.502411 br-lan In  IP 192.168.2.248.40002 > 124.75.25.215.7777: UDP, length 16
16:01:13.502532 br-vlan85 Out IP 30.180.227.167.40002 > 124.75.25.215.7777: UDP, length 16
16:01:13.502534 eth0.85 Out IP 30.180.227.167.40002 > 124.75.25.215.7777: UDP, length 16
16:01:13.502537 eth0  Out IP 30.180.227.167.40002 > 124.75.25.215.7777: UDP, length 16
16:01:13.503631 eth3  P   IP 192.168.2.248.40068 > 124.75.25.215.7777: UDP, length 120
16:01:13.503631 br-lan In  IP 192.168.2.248.40068 > 124.75.25.215.7777: UDP, length 120
16:01:13.503725 br-vlan85 Out IP 30.180.227.167.40068 > 124.75.25.215.7777: UDP, length 40
16:01:13.503729 eth0.85 Out IP 30.180.227.167.40068 > 124.75.25.215.7777: UDP, length 40
16:01:13.503732 eth0  Out IP 30.180.227.167.40068 > 124.75.25.215.7777: UDP, length 40
16:01:13.503736 br-vlan85 Out IP 30.180.227.167.40068 > 124.75.25.215.7777: UDP, length 40
16:01:13.503739 eth0.85 Out IP 30.180.227.167.40068 > 124.75.25.215.7777: UDP, length 40
16:01:13.503741 eth0  Out IP 30.180.227.167.40068 > 124.75.25.215.7777: UDP, length 40
16:01:13.503744 br-vlan85 Out IP 30.180.227.167.40068 > 124.75.25.215.7777: UDP, length 40
16:01:13.503746 eth0.85 Out IP 30.180.227.167.40068 > 124.75.25.215.7777: UDP, length 40
16:01:13.503749 eth0  Out IP 30.180.227.167.40068 > 124.75.25.215.7777: UDP, length 40
16:01:13.508384 eth0  In  IP 124.75.25.215.7777 > 30.180.227.167.40068: UDP, length 36
16:01:13.508384 eth0.85 In  IP 124.75.25.215.7777 > 30.180.227.167.40068: UDP, length 36
16:01:13.508384 br-vlan85 In  IP 124.75.25.215.7777 > 30.180.227.167.40068: UDP, length 36
16:01:13.508429 br-lan Out IP 124.75.25.215.7777 > 192.168.2.248.40068: UDP, length 36
16:01:13.508435 eth3  Out IP 124.75.25.215.7777 > 192.168.2.248.40068: UDP, length 36
16:01:13.508597 eth3  P   IP 192.168.2.248.40068 > 124.75.25.215.40068: UDP, length 0
16:01:13.508597 br-lan In  IP 192.168.2.248.40068 > 124.75.25.215.40068: UDP, length 0
16:01:13.508670 br-vlan85 Out IP 30.180.227.167.40068 > 124.75.25.215.40068: UDP, length 0
16:01:13.508674 eth0.85 Out IP 30.180.227.167.40068 > 124.75.25.215.40068: UDP, length 0
16:01:13.508677 eth0  Out IP 30.180.227.167.40068 > 124.75.25.215.40068: UDP, length 0
16:01:13.508597 eth3  P   IP 192.168.2.248.40068 > 124.75.25.215.40068: UDP, length 0
16:01:13.508597 br-lan In  IP 192.168.2.248.40068 > 124.75.25.215.40068: UDP, length 0
16:01:13.508710 br-vlan85 Out IP 30.180.227.167.40068 > 124.75.25.215.40068: UDP, length 0
16:01:13.508713 eth0.85 Out IP 30.180.227.167.40068 > 124.75.25.215.40068: UDP, length 0
16:01:13.508715 eth0  Out IP 30.180.227.167.40068 > 124.75.25.215.40068: UDP, length 0
16:01:13.508597 eth3  P   IP 192.168.2.248.40068 > 124.75.25.215.40068: UDP, length 0
16:01:13.508597 br-lan In  IP 192.168.2.248.40068 > 124.75.25.215.40068: UDP, length 0
16:01:13.508736 br-vlan85 Out IP 30.180.227.167.40068 > 124.75.25.215.40068: UDP, length 0
16:01:13.508738 eth0.85 Out IP 30.180.227.167.40068 > 124.75.25.215.40068: UDP, length 0
16:01:13.508740 eth0  Out IP 30.180.227.167.40068 > 124.75.25.215.40068: UDP, length 0
16:01:13.508937 eth0  In  IP 124.75.25.215.56297 > 30.180.227.167.40068: UDP, length 1328
16:01:13.508937 eth0.85 In  IP 124.75.25.215.56297 > 30.180.227.167.40068: UDP, length 1328
16:01:13.508937 br-vlan85 In  IP 124.75.25.215.56297 > 30.180.227.167.40068: UDP, length 1328
16:01:13.509061 br-vlan85 Out IP 30.180.227.167 > 124.75.25.215: ICMP 30.180.227.167 udp port 40068 unreachable, length 556
16:01:13.509066 eth0.85 Out IP 30.180.227.167 > 124.75.25.215: ICMP 30.180.227.167 udp port 40068 unreachable, length 556
16:01:13.509071 eth0  Out IP 30.180.227.167 > 124.75.25.215: ICMP 30.180.227.167 udp port 40068 unreachable, length 556
16:01:13.509353 eth0  In  IP 124.75.25.215.56297 > 30.180.227.167.40068: UDP, length 1328
16:01:13.509353 eth0.85 In  IP 124.75.25.215.56297 > 30.180.227.167.40068: UDP, length 1328
16:01:13.509353 br-vlan85 In  IP 124.75.25.215.56297 > 30.180.227.167.40068: UDP, length 1328
16:01:13.509408 br-vlan85 Out IP 30.180.227.167 > 124.75.25.215: ICMP 30.180.227.167 udp port 40068 unreachable, length 556
16:01:13.509412 eth0.85 Out IP 30.180.227.167 > 124.75.25.215: ICMP 30.180.227.167 udp port 40068 unreachable, length 556
16:01:13.509416 eth0  Out IP 30.180.227.167 > 124.75.25.215: ICMP 30.180.227.167 udp port 40068 unreachable, length 556
16:01:13.510418 eth0  In  IP 124.75.25.215.56297 > 30.180.227.167.40068: UDP, length 1328
16:01:13.510418 eth0.85 In  IP 124.75.25.215.56297 > 30.180.227.167.40068: UDP, length 1328
16:01:13.510418 br-vlan85 In  IP 124.75.25.215.56297 > 30.180.227.167.40068: UDP, length 1328
16:01:13.510476 br-vlan85 Out IP 30.180.227.167 > 124.75.25.215: ICMP 30.180.227.167 udp port 40068 unreachable, length 556
16:01:13.510480 eth0.85 Out IP 30.180.227.167 > 124.75.25.215: ICMP 30.180.227.167 udp port 40068 unreachable, length 556
16:01:13.510484 eth0  Out IP 30.180.227.167 > 124.75.25.215: ICMP 30.180.227.167 udp port 40068 unreachable, length 556
16:01:13.511415 eth0  In  IP 124.75.25.215.56297 > 30.180.227.167.40068: UDP, length 2656
16:01:13.511415 eth0.85 In  IP 124.75.25.215.56297 > 30.180.227.167.40068: UDP, length 2656
16:01:13.511415 br-vlan85 In  IP 124.75.25.215.56297 > 30.180.227.167.40068: UDP, length 2656
16:01:13.511469 br-vlan85 Out IP 30.180.227.167 > 124.75.25.215: ICMP 30.180.227.167 udp port 40068 unreachable, length 556
16:01:13.511473 eth0.85 Out IP 30.180.227.167 > 124.75.25.215: ICMP 30.180.227.167 udp port 40068 unreachable, length 556
16:01:13.511478 eth0  Out IP 30.180.227.167 > 124.75.25.215: ICMP 30.180.227.167 udp port 40068 unreachable, length 556
16:01:13.512390 eth0  In  IP 124.75.25.215.56297 > 30.180.227.167.40068: UDP, length 1328
16:01:13.512390 eth0.85 In  IP 124.75.25.215.56297 > 30.180.227.167.40068: UDP, length 1328
16:01:13.512390 br-vlan85 In  IP 124.75.25.215.56297 > 30.180.227.167.40068: UDP, length 1328
16:01:13.512444 br-vlan85 Out IP 30.180.227.167 > 124.75.25.215: ICMP 30.180.227.167 udp port 40068 unreachable, length 556
16:01:13.512448 eth0.85 Out IP 30.180.227.167 > 124.75.25.215: ICMP 30.180.227.167 udp port 40068 unreachable, length 556
16:01:13.512451 eth0  Out IP 30.180.227.167 > 124.75.25.215: ICMP 30.180.227.167 udp port 40068 unreachable, length 556
16:01:13.513573 eth0  In  IP 124.75.25.215.56297 > 30.180.227.167.40068: UDP, length 2656
16:01:13.513573 eth0.85 In  IP 124.75.25.215.56297 > 30.180.227.167.40068: UDP, length 2656
16:01:13.513573 br-vlan85 In  IP 124.75.25.215.56297 > 30.180.227.167.40068: UDP, length 2656
16:01:13.513628 br-vlan85 Out IP 30.180.227.167 > 124.75.25.215: ICMP 30.180.227.167 udp port 40068 unreachable, length 556
16:01:13.513632 eth0.85 Out IP 30.180.227.167 > 124.75.25.215: ICMP 30.180.227.167 udp port 40068 unreachable, length 556
16:01:13.513636 eth0  Out IP 30.180.227.167 > 124.75.25.215: ICMP 30.180.227.167 udp port 40068 unreachable, length 556
```

此路由器配置，rtp2httpd架设在路由器上，接口设置留空（走策略路由），组播，FCC一切正常，内网现在问 AI说大包udp没有传输到内网docker容器里。麻烦大佬解惑。

**Comment by stackia** [comment]
你这种情况需要做端口转发，把一整段fcc客户端端口从路由器转发到运行rtp2httpd的主机上

https://rtp2httpd.com/guide/fcc-setup#电信-fcc-协议

**Comment by bsdcpp** [comment]
> 你这种情况需要做端口转发，把一整段fcc客户端端口从路由器转发到运行rtp2httpd的主机上
> 
> [https://rtp2httpd.com/guide/fcc-setup#电信-fcc-协议](https://rtp2httpd.com/guide/fcc-setup#%E7%94%B5%E4%BF%A1-fcc-%E5%8D%8F%E8%AE%AE)

感谢大佬回复，做了DNAT确实可以了，请教这是因为Docker的问题，还是路由器转发上面出现了问题？照理由iptv接口做了masq了会自动转发的。

**Comment by stackia** [comment]
FCC工作类似FTP主动模式，对NAT不友好，需要手动做端口转发
